{
  "$schema": "../schema/signs.schema.json",
  "file_kind": "signs",
  "version": "2026.10.0",
  "status": "draft",
  "licence": "CC-BY-4.0",
  "attribution": "Margdarshak content pack, team Chanakya (Nestiq Private Limited), 2026",
  "notes": "Sign catalogue for the LL bank, lessons and SignSnap (closed IDs). Meanings follow the IRC:67 families (mandatory: circles, red border = prohibition, blue = compulsory; stop octagon; give-way inverted triangle; cautionary: red-bordered triangles; informatory: rectangles), markings follow IRC:35, signals the MV (Driving) Regulations; none of these texts has been fetched and checked yet, so every sign is verified=false and needs the two-person check against the standard (CURRICULUM §2.1 review needs). check_note lists drawing details to confirm. Assets are vectors we still have to draw. SIGN-MAN-016 is intentionally unused (a height-limit sign was dropped until its IRC:67 drawing is confirmed).",
  "signs": [
    {
      "sign_id": "SIGN-MAN-001",
      "family": "MANDATORY",
      "subfamily": "stop",
      "shape": "octagon",
      "colour_scheme": "red_octagon_white_text",
      "colours": ["red", "white"],
      "symbol_class": "stop_text",
      "alt": {
        "en": "Red octagon with the word STOP in white letters",
        "hi": "लाल अष्टकोण, जिस पर सफ़ेद अक्षरों में STOP लिखा है"
      },
      "name": {
        "en": "Stop",
        "hi": "रुकें (STOP)"
      },
      "meaning": {
        "en": "Stop completely at the stop line and go only when the way is clear.",
        "hi": "स्टॉप लाइन पर पूरी तरह रुकें और रास्ता साफ़ होने पर ही आगे बढ़ें।"
      },
      "mirror_of": null,
      "standard": "IRC:67",
      "sources": [
        {
          "title": "IRC:67 Code of Practice for Road Signs, Indian Roads Congress (edition and clause to pin)",
          "url": null,
          "grade": "MK",
          "pin_status": "to_pin",
          "checked_on": null,
          "note": "Meanings authored from the standard's sign families; not checked against a fetched copy. We draw our own vectors and cite the standard; we do not reproduce its pages."
        },
        {
          "title": "Motor Vehicles Act 1988, Schedule of traffic signs (to pin)",
          "url": "https://www.indiacode.nic.in",
          "grade": "MK",
          "pin_status": "to_pin",
          "checked_on": null
        }
      ],
      "verified": false,
      "asset": {
        "path": "signs/SIGN-MAN-001.svg",
        "status": "to_draw"
      },
      "review_status": "draft",
      "hi_review_status": "pending_native_review"
    },
    {
      "sign_id": "SIGN-MAN-002",
      "family": "MANDATORY",
      "subfamily": "give_way",
      "shape": "inverted_triangle",
      "colour_scheme": "white_inverted_triangle_red_border",
      "colours": ["red", "white"],
      "symbol_class": "plain",
      "alt": {
        "en": "Downward-pointing triangle with a red border and a white centre",
        "hi": "नीचे की ओर नोक वाला त्रिकोण, लाल किनारा और बीच में सफ़ेद"
      },
      "name": {
        "en": "Give way",
        "hi": "रास्ता दें"
      },
      "meaning": {
        "en": "Slow down and let traffic on the road you are joining go first; stop if needed.",
        "hi": "धीमे हों और जिस सड़क में जा रहे हैं उसके ट्रैफ़िक को पहले जाने दें; ज़रूरत हो तो रुकें।"
      },
      "mirror_of": null,
      "standard": "IRC:67",
      "sources": [
        {
          "title": "IRC:67 Code of Practice for Road Signs, Indian Roads Congress (edition and clause to pin)",
          "url": null,
          "grade": "MK",
          "pin_status": "to_pin",
          "checked_on": null,
          "note": "Meanings authored from the standard's sign families; not checked against a fetched copy. We draw our own vectors and cite the standard; we do not reproduce its pages."
        },
        {
          "title": "Motor Vehicles Act 1988, Schedule of traffic signs (to pin)",
          "url": "https://www.indiacode.nic.in",
          "grade": "MK",
          "pin_status": "to_pin",
          "checked_on": null
        }
      ],
      "verified": false,
      "check_note": "Confirm whether the IRC:67 give-way sign carries text inside the triangle.",
      "asset": {
        "path": "signs/SIGN-MAN-002.svg",
        "status": "to_draw"
      },
      "review_status": "draft",
      "hi_review_status": "pending_native_review"
    },
    {
      "sign_id": "SIGN-MAN-003",
      "family": "MANDATORY",
      "subfamily": "prohibitory",
      "shape": "circle",
      "colour_scheme": "red_disc_white_bar",
      "colours": ["red", "white"],
      "symbol_class": "bar",
      "alt": {
        "en": "Red circle with a white horizontal bar across the middle",
        "hi": "लाल गोला, जिसके बीच में सफ़ेद आड़ी पट्टी है"
      },
      "name": {
        "en": "No entry",
        "hi": "प्रवेश निषेध"
      },
      "meaning": {
        "en": "Vehicles must not enter the road from this side.",
        "hi": "इस ओर से वाहन सड़क में प्रवेश नहीं कर सकते।"
      },
      "mirror_of": null,
      "standard": "IRC:67",
      "sources": [
        {
          "title": "IRC:67 Code of Practice for Road Signs, Indian Roads Congress (edition and clause to pin)",
          "url": null,
          "grade": "MK",
          "pin_status": "to_pin",
          "checked_on": null,
          "note": "Meanings authored from the standard's sign families; not checked against a fetched copy. We draw our own vectors and cite the standard; we do not reproduce its pages."
        },
        {
          "title": "Motor Vehicles Act 1988, Schedule of traffic signs (to pin)",
          "url": "https://www.indiacode.nic.in",
          "grade": "MK",
          "pin_status": "to_pin",
          "checked_on": null
        }
      ],
      "verified": false,
      "asset": {
        "path": "signs/SIGN-MAN-003.svg",
        "status": "to_draw"
      },
      "review_status": "draft",
      "hi_review_status": "pending_native_review"
    },
    {
      "sign_id": "SIGN-MAN-004",
      "family": "MANDATORY",
      "subfamily": "prohibitory",
      "shape": "circle",
      "colour_scheme": "white_disc_red_border",
      "colours": ["red", "white", "black"],
      "symbol_class": "plain",
      "alt": {
        "en": "White circle with a red border and nothing inside",
        "hi": "लाल किनारे वाला सफ़ेद गोला, अंदर कुछ नहीं"
      },
      "name": {
        "en": "Vehicles prohibited in both directions",
        "hi": "दोनों दिशाओं में वाहन निषेध"
      },
      "meaning": {
        "en": "No vehicle may use this road from either direction.",
        "hi": "इस सड़क पर किसी भी दिशा से वाहन नहीं जा सकते।"
      },
      "mirror_of": null,
      "standard": "IRC:67",
      "sources": [
        {
          "title": "IRC:67 Code of Practice for Road Signs, Indian Roads Congress (edition and clause to pin)",
          "url": null,
          "grade": "MK",
          "pin_status": "to_pin",
          "checked_on": null,
          "note": "Meanings authored from the standard's sign families; not checked against a fetched copy. We draw our own vectors and cite the standard; we do not reproduce its pages."
        },
        {
          "title": "Motor Vehicles Act 1988, Schedule of traffic signs (to pin)",
          "url": "https://www.indiacode.nic.in",
          "grade": "MK",
          "pin_status": "to_pin",
          "checked_on": null
        }
      ],
      "verified": false,
      "asset": {
        "path": "signs/SIGN-MAN-004.svg",
        "status": "to_draw"
      },
      "review_status": "draft",
      "hi_review_status": "pending_native_review"
    },
    {
      "sign_id": "SIGN-MAN-005",
      "family": "MANDATORY",
      "subfamily": "prohibitory",
      "shape": "circle",
      "colour_scheme": "white_disc_red_border",
      "colours": ["red", "white", "black"],
      "symbol_class": "vehicle",
      "alt": {
        "en": "White circle with a red border and a black truck inside",
        "hi": "लाल किनारे वाला सफ़ेद गोला, अंदर काला ट्रक"
      },
      "name": {
        "en": "Truck prohibited",
        "hi": "ट्रक निषेध"
      },
      "meaning": {
        "en": "Trucks must not enter this road.",
        "hi": "इस सड़क पर ट्रक नहीं जा सकते।"
      },
      "mirror_of": null,
      "standard": "IRC:67",
      "sources": [
        {
          "title": "IRC:67 Code of Practice for Road Signs, Indian Roads Congress (edition and clause to pin)",
          "url": null,
          "grade": "MK",
          "pin_status": "to_pin",
          "checked_on": null,
          "note": "Meanings authored from the standard's sign families; not checked against a fetched copy. We draw our own vectors and cite the standard; we do not reproduce its pages."
        },
        {
          "title": "Motor Vehicles Act 1988, Schedule of traffic signs (to pin)",
          "url": "https://www.indiacode.nic.in",
          "grade": "MK",
          "pin_status": "to_pin",
          "checked_on": null
        }
      ],
      "verified": false,
      "asset": {
        "path": "signs/SIGN-MAN-005.svg",
        "status": "to_draw"
      },
      "review_status": "draft",
      "hi_review_status": "pending_native_review"
    },
    {
      "sign_id": "SIGN-MAN-006",
      "family": "MANDATORY",
      "subfamily": "prohibitory",
      "shape": "circle",
      "colour_scheme": "white_disc_red_border",
      "colours": ["red", "white", "black"],
      "symbol_class": "vehicle",
      "alt": {
        "en": "White circle with a red border and a black bicycle inside",
        "hi": "लाल किनारे वाला सफ़ेद गोला, अंदर काली साइकिल"
      },
      "name": {
        "en": "Cycle prohibited",
        "hi": "साइकिल निषेध"
      },
      "meaning": {
        "en": "Cycles must not enter this road.",
        "hi": "इस सड़क पर साइकिल नहीं जा सकती।"
      },
      "mirror_of": null,
      "standard": "IRC:67",
      "sources": [
        {